<?xml version="1.0" encoding="UTF-8" ?>
<module xmlns:xsi="http://www.w3.org/2001/XMLSchema-instance" xsi:noNamespaceSchemaLocation="../schema/model.xsd">

  <name>mymodule</name>
  <version>1.0.0</version>
  <display-name>My Test Module</display-name>

  <vendor>
    <name>Enonic</name>
    <url>http://www.enonic.com</url>
  </vendor>

  <config>
    <mixin-reference name="test">
      <reference>mymodule-1.0.0:other</reference>
    </mixin-reference>
  </config>

  <metadata-schemas>
    <metadata-schema name="menu">
      <form>
        <input name="show" type="Boolean"/>
      </form>
    </metadata-schema>
  </metadata-schemas>

</module>
