<?xml version="1.0" encoding="UTF-8" standalone="yes"?>
<relationship-type xmlns:xsi="http://www.w3.org/2001/XMLSchema-instance" xsi:noNamespaceSchemaLocation="../schema/model.xsd">
  <description>description</description>
  <from-semantic>likes</from-semantic>
  <to-semantic>liked by</to-semantic>
  <allowed-from-types>
    <content-type>mymodule-1.0.0:animal</content-type>
    <content-type>mymodule-1.0.0:person</content-type>
  </allowed-from-types>
  <allowed-to-types>
    <content-type>mymodule-1.0.0:vehicle</content-type>
  </allowed-to-types>
</relationship-type>
