<?xml version="1.0" encoding="UTF-8" ?>
<node xmlns:xsi="http://www.w3.org/2001/XMLSchema-instance" xsi:noNamespaceSchemaLocation="../schema/model.xsd">
  <id>f95b70fdc3088560732a5ac135644506</id>
  <created-time>2008-09-29T03:49:45</created-time>
  <modified-time>2014-09-19T01:18:33</modified-time>
  <creator>user:system:admin</creator>
  <modifier>user:system:admin</modifier>

  <data name="data">
    <property name="display-name" type="String">Fisk</property>
    <property name="content-type" type="String">com.enonic.system:article</property>
    <property name="draft" type="Boolean">false</property>
    <property-set name="form">
      <property-set name="Input">
        <property name="name" type="String">textline</property>
        <property name="label" type="String">Text Line</property>
        <property name="customText" type="String">customText</property>
        <property name="helpText" type="String">Some help text</property>
        <property name="immutable" type="String">false</property>
        <property name="indexed" type="Boolean">true</property>

        <property-set name="occurrences">
          <property name="minimum" type="Long">0</property>
          <property name="maximum" type="Long">1</property>
        </property-set>

      </property-set>

    </property-set>

  </data>
</node>
