<?xml version="1.0" encoding="UTF-8"?>
<part-component xmlns:xsi="http://www.w3.org/2001/XMLSchema-instance" xsi:noNamespaceSchemaLocation="../schema/model.xsd">
  <display-name>A Part</display-name>
  <config>
    <input name="width" type="Double">
      <label>Column width</label>
      <immutable>false</immutable>
      <indexed>false</indexed>
      <occurrences minimum="0" maximum="1"/>
    </input>
  </config>
</part-component>
